{
  "id": "Advize_PlantEverything",
  "package": "Advize-PlantEverything",
  "version": "1.21.4",
  "assembly": "Advize_PlantEverything",
  "guids": [
    "advize.PlantEverything"
  ],
  "words": {
    "peLingonberryBushName": "Куст брусники",
    "peLingonberryBushDescription": "Посадите бруснику, чтобы вырастить куст брусники.",
    "peAncientSaplingName": "Саженец старого дерева",
    "peAncientSaplingDescription": "Посадите саженец старого дерева.",
    "peYggaSaplingName": "Саженец Иггдрасиля",
    "peYggaSaplingDescription": "Посадите саженец Иггдрасиля.",
    "peAutumnBirchSaplingName": "Саженец осенней березы",
    "peAutumnBirchSaplingDescription": "Разновидность с Равнин",
    "peAshwoodSaplingName": "Саженец пепельного дерева",
    "peAshwoodSaplingDescription": "Посадите саженец пепельного дерева.",
    "peVineAshSaplingName": "Настраиваемая пепельная лоза",
    "peVineAshSaplingDescription": "Высаживает пепельную лозу с окраской, заданной в настройках мода.",
    "peRaspberryBushName": "Куст малины",
    "peRaspberryBushDescription": "Посадите малину, чтобы вырастить куст малины.",
    "peBlueberryBushName": "Куст черники",
    "peBlueberryBushDescription": "Посадите чернику, чтобы вырастить куст черники.",
    "peCloudberryBushName": "Куст морошки",
    "peCloudberryBushDescription": "Посадите морошку, чтобы вырастить куст морошки.",
    "pePickableMushroomName": "Грибы для сбора",
    "pePickableMushroomDescription": "Посадите грибы, чтобы выросло больше грибов для сбора.",
    "pePickableYellowMushroomName": "Желтые грибы для сбора",
    "pePickableYellowMushroomDescription": "Посадите желтые грибы, чтобы выросло больше желтых грибов для сбора.",
    "pePickableBlueMushroomName": "Голубые грибы для сбора",
    "pePickableBlueMushroomDescription": "Посадите голубые грибы, чтобы выросло больше голубых грибов для сбора.",
    "pePickableThistleName": "Чертополох для сбора",
    "pePickableThistleDescription": "Посадите чертополох, чтобы вырос еще чертополох для сбора.",
    "pePickableDandelionName": "Одуванчик для сбора",
    "pePickableDandelionDescription": "Посадите одуванчик, чтобы выросли еще одуванчики для сбора.",
    "peBeechSmallName": "Маленький бук",
    "peBeechSmallDescription": "Посадите маленький бук.",
    "peFirSmallName": "Маленькая пихта",
    "peFirSmallDescription": "Посадите маленькую пихту.",
    "peFirSmallDeadName": "Маленькая сухая пихта",
    "peFirSmallDeadDescription": "Посадите маленькую сухую пихту.",
    "peBush01Name": "Маленький куст 1",
    "peBush01Description": "Посадите маленький куст.",
    "peBush02Name": "Маленький куст 2",
    "peBush02Description": "Посадите маленький куст.",
    "pePlainsBushName": "Маленький куст Равнин",
    "pePlainsBushDescription": "Посадите куст, растущий на Равнинах.",
    "peShrub01Name": "Маленький кустарник 1",
    "peShrub01Description": "Посадите маленький кустарник.",
    "peShrub02Name": "Маленький кустарник 2",
    "peShrub02Description": "Посадите маленький кустарник.",
    "peYggaShootName": "Маленькая ветвь Иггдрасиля",
    "peYggaShootDescription": "Посадите маленькую ветвь Иггдрасиля.",
    "peVinesName": "Лоза",
    "peVinesDescription": "Посадите лозу.",
    "peAshlandsFernName": "Папоротник Пепельных земель",
    "peAshlandsFernDescription": "Посадите папоротник, растущий в Пепельных землях.",
    "pePickableBranchName": "Ветка для сбора",
    "pePickableBranchDescription": "Разместите ветки для сбора. Собранные ветки со временем появляются снова.",
    "pePickableStoneName": "Камень для сбора",
    "pePickableStoneDescription": "Разместите камень, который можно подобрать.",
    "pePickableFlintName": "Кремень для сбора",
    "pePickableFlintDescription": "Разместите кремень для сбора. Собранный кремень со временем появляется снова.",
    "pePickableSmokePuffName": "Дымчатый гриб для сбора",
    "pePickableSmokePuffDescription": "Посадите дымчатые грибы, чтобы выросло больше дымчатых грибов для сбора.",
    "pePickableFiddleheadName": "Рахис для сбора",
    "pePickableFiddleheadDescription": "Посадите рахис, чтобы вырос еще рахис для сбора.",
    "peGrowthTimeHoverPrefix": "Созреет через"
  },
  "englishWords": {
    "peLingonberryBushName": "Lingonberry Bush",
    "peLingonberryBushDescription": "Plant lingonberries to grow lingonberry bushes.",
    "peAncientSaplingName": "Ancient Sapling",
    "peAncientSaplingDescription": "peAncientSaplingDescription",
    "peYggaSaplingName": "Ygga Sapling",
    "peYggaSaplingDescription": "peYggaSaplingDescription",
    "peAutumnBirchSaplingName": "Autumn Birch Sapling",
    "peAutumnBirchSaplingDescription": "Plains Variant",
    "peAshwoodSaplingName": "Ashwood Sapling",
    "peAshwoodSaplingDescription": "peAshwoodSaplingDescription",
    "peVineAshSaplingName": "Custom Ashvine",
    "peVineAshSaplingDescription": "Plants an Ashvine sapling with the colours defined in the mod config.",
    "peRaspberryBushName": "Raspberry Bush",
    "peRaspberryBushDescription": "Plant raspberries to grow raspberry bushes.",
    "peBlueberryBushName": "Blueberry Bush",
    "peBlueberryBushDescription": "Plant blueberries to grow blueberry bushes.",
    "peCloudberryBushName": "Cloudberry Bush",
    "peCloudberryBushDescription": "Plant cloudberries to grow cloudberry bushes.",
    "pePickableMushroomName": "Pickable Mushrooms",
    "pePickableMushroomDescription": "Plant mushrooms to grow more pickable mushrooms.",
    "pePickableYellowMushroomName": "Pickable Yellow Mushrooms",
    "pePickableYellowMushroomDescription": "Plant yellow mushrooms to grow more pickable yellow mushrooms.",
    "pePickableBlueMushroomName": "Pickable Blue Mushrooms",
    "pePickableBlueMushroomDescription": "Plant blue mushrooms to grow more pickable blue mushrooms.",
    "pePickableThistleName": "Pickable Thistle",
    "pePickableThistleDescription": "Plant thistle to grow more pickable thistle.",
    "pePickableDandelionName": "Pickable Dandelion",
    "pePickableDandelionDescription": "Plant dandelion to grow more pickable dandelion.",
    "peBeechSmallName": "Small Beech Tree",
    "peBeechSmallDescription": "Plant a small beech tree.",
    "peFirSmallName": "Small Fir Tree",
    "peFirSmallDescription": "Plant a small fir tree.",
    "peFirSmallDeadName": "Small Dead Fir Tree",
    "peFirSmallDeadDescription": "Plant a small dead fir tree.",
    "peBush01Name": "Small Bush 1",
    "peBush01Description": "Plant a small bush.",
    "peBush02Name": "Small Bush 2",
    "peBush02Description": "Plant a small bush.",
    "pePlainsBushName": "Small Plains Bush",
    "pePlainsBushDescription": "Plant a bush native to the plains.",
    "peShrub01Name": "Small Shrub 1",
    "peShrub01Description": "Plant a small shrub.",
    "peShrub02Name": "Small Shrub 2",
    "peShrub02Description": "Plant a small shrub.",
    "peYggaShootName": "Small Ygga Shoot",
    "peYggaShootDescription": "Plant a small ygga shoot.",
    "peVinesName": "Vines",
    "peVinesDescription": "Plant vines.",
    "peAshlandsFernName": "Ashlands Fern",
    "peAshlandsFernDescription": "Plant a fern native to the ashlands.",
    "pePickableBranchName": "Pickable Branch",
    "pePickableBranchDescription": "Plant respawning pickable branches.",
    "pePickableStoneName": "Pickable Stone",
    "pePickableStoneDescription": "Plant pickable stone.",
    "pePickableFlintName": "Pickable Flint",
    "pePickableFlintDescription": "Plant respawning pickable flint.",
    "pePickableSmokePuffName": "Pickable Smoke Puff",
    "pePickableSmokePuffDescription": "Plant smoke puffs to grow more pickable smoke puffs.",
    "pePickableFiddleheadName": "Pickable Fiddlehead",
    "pePickableFiddleheadDescription": "Plant fiddlehead to grow more pickable fiddlehead.",
    "peGrowthTimeHoverPrefix": "Ready in"
  },
  "texts": {},
  "patterns": [],
  "returns": [],
  "prefabs": [],
  "sourceFiles": [
    "source-evidence/profile-updates/Advize-PlantEverything-1.21.4/Advize_PlantEverything/PlantEverything.cs",
    "source-evidence/profile-updates/Advize-PlantEverything-1.21.4/ServerSync/VersionCheck.cs"
  ],
  "notes": [
    "version — версия пакета Gale; pluginVersion и assembly — метаданные приложенной декомпиляции. Игровой запуск не выполнен.",
    "Пакет текущего профиля проверен 2026-10-20 по точной установленной DLL и декомпиляции; версия пакета и BepInPlugin сверены отдельно. Игровая приёмка относится к общей квитанции выпуска."
  ],
  "namespaces": [
    "Advize_PlantEverything",
    "ServerSync"
  ],
  "pluginVersion": "1.21.4",
  "literals": [
    {
      "type": "ServerSync.VersionCheck",
      "method": "ErrorServer",
      "values": {
        "Disconnect: The client (": "Отключение: у клиента (",
        ") doesn't have the correct ": ") неподходящая версия ",
        " version ": " — нужна версия "
      }
    },
    {
      "type": "ServerSync.VersionCheck",
      "method": "ErrorClient",
      "values": {
        " is not installed on the server.": " не установлен на сервере.",
        " needs to be at least version ": " — нужна версия не ниже ",
        ". You have version ": ". У вас версия ",
        " may not be higher than version ": " — версия должна быть не выше "
      }
    },
    {
      "type": "ServerSync.VersionCheck",
      "method": "ShowConnectionError",
      "values": {
        "\nServer expects you to have ": "\nСервер требует установить ",
        " (Version: ": " (версия: ",
        ") installed.": ")."
      }
    }
  ]
}
