{
  "id": "AzuCraftyBoxes",
  "package": "Azumatt-AzuCraftyBoxes",
  "version": "1.8.28",
  "assembly": "AzuCraftyBoxes",
  "guids": [
    "Azumatt.AzuCraftyBoxes"
  ],
  "words": {},
  "englishWords": {},
  "texts": {
    "Pull from containers? Yes": "Брать из сундуков? Да",
    "Pull from containers? No": "Брать из сундуков? Нет",
    "Pull from containers? Only mine": "Брать из сундуков? Только из моих",
    "Pull from containers?": "Брать из сундуков?",
    "Only mine": "Только из моих",
    "Yes": "Да",
    "No": "Нет",
    "<size=30><color=#ffffff>Pull from containers?</color></size>": "<size=30><color=#ffffff>Брать из сундуков?</color></size>"
  },
  "patterns": [
    {
      "source": "{0} is not installed on the server.",
      "target": "{0} не установлен на сервере.",
      "singleLine": true
    },
    {
      "source": "{0} needs to be at least version {1}. You have version {2}.",
      "target": "{0} — нужна версия не ниже {1}. У вас версия {2}.",
      "singleLine": true
    },
    {
      "source": "{0} may not be higher than version {1}. You have version {2}.",
      "target": "{0} — версия должна быть не выше {1}. У вас версия {2}.",
      "singleLine": true
    },
    {
      "source": "AzuCraftyBoxes Installed: {0}",
      "target": "AzuCraftyBoxes: установлена версия {0}",
      "singleLine": true
    },
    {
      "source": "Needed: {0}",
      "target": "Требуется: {0}",
      "singleLine": true
    },
    {
      "source": "$msg_added {0} items",
      "target": "$msg_added {0} шт.",
      "singleLine": true
    },
    {
      "source": "Pull from containers? {0}",
      "target": "Брать из сундуков? {0}",
      "singleLine": true
    }
  ],
  "returns": [],
  "prefabs": [],
  "sourceFiles": [
    "source-evidence/profile-updates/Azumatt-AzuCraftyBoxes-1.8.28/AzuCraftyBoxes/AzuCraftyBoxesPlugin.cs",
    "source-evidence/profile-updates/Azumatt-AzuCraftyBoxes-1.8.28/AzuCraftyBoxes.Patches/FireplaceGetHoverTextPatch.cs",
    "source-evidence/profile-updates/Azumatt-AzuCraftyBoxes-1.8.28/AzuCraftyBoxes.Patches/TurretGetHoverTextPatch.cs",
    "source-evidence/profile-updates/Azumatt-AzuCraftyBoxes-1.8.28/AzuCraftyBoxes.Patches/OverrideHoverTextSg.cs",
    "source-evidence/profile-updates/Azumatt-AzuCraftyBoxes-1.8.28/AzuCraftyBoxes.Patches/OverrideHoverText.cs",
    "source-evidence/profile-updates/Azumatt-AzuCraftyBoxes-1.8.28/AzuCraftyBoxes.Patches/OverrideHoverTextFermenter.cs",
    "source-evidence/profile-updates/Azumatt-AzuCraftyBoxes-1.8.28/AzuCraftyBoxes.Patches/SE_ContainerPull.cs",
    "source-evidence/profile-updates/Azumatt-AzuCraftyBoxes-1.8.28/Backpacks/ItemContainer.cs",
    "source-evidence/profile-updates/Azumatt-AzuCraftyBoxes-1.8.28/ServerSync/VersionCheck.cs",
    "source-evidence/profile-updates/Azumatt-AzuCraftyBoxes-1.8.28/AzuCraftyBoxes/RpcHandlers.cs",
    "source-evidence/profile-updates/Azumatt-AzuCraftyBoxes-1.8.28/AzuCraftyBoxes/ShowConnectionError.cs",
    "source-evidence/profile-updates/Azumatt-AzuCraftyBoxes-1.8.28/AzuCraftyBoxes/RegisterAndCheckVersion.cs",
    "source-evidence/profile-updates/Azumatt-AzuCraftyBoxes-1.8.28/AzuCraftyBoxes.csproj",
    "source-evidence/profile-updates/Azumatt-AzuCraftyBoxes-1.8.28/AzuCraftyBoxes.il",
    "source-evidence/profile-updates/Azumatt-AzuCraftyBoxes-1.8.28/AzuCraftyBoxes.Patches/ShieldGeneratorOnAddFuelPatch.cs",
    "source-evidence/profile-updates/Azumatt-AzuCraftyBoxes-1.8.28/AzuCraftyBoxes.Patches/Turret_UseItem_Patch.cs"
  ],
  "notes": [
    "version — версия пакета Gale; pluginVersion и assembly — метаданные приложенной декомпиляции. Игровой запуск не выполнен.",
    "rawTexts и rawPatterns: строки, которые мод хранит в объектах (названия, описания, записи Compendium, составные имена). Переводятся только при показе через Localization.Localize; сохранённые данные не меняются.",
    "Checked against Azumatt-AzuCraftyBoxes 1.8.27; AzuCraftyBoxes.dll SHA-256: 432285a08aa0d43bbd89b36330bedc19cb6ea93aed439e493d0287edaecedeb4. Existing UI literal targets remain present. Game rendering was not tested.",
    "ServerSync ErrorClient and ErrorServer source methods remain untranslated: their results are used in logs. Client errors translate only on TMP_Text.text assignment in ServerSync.VersionCheck.ShowConnectionError. ErrorServer is log-only. RPC version payloads, version comparisons, technical names and sender logs remain unchanged.",
    "The AzuCraftyBoxes Installed / Needed message translates only on TMP_Text.text assignment in AzuCraftyBoxes.ShowConnectionError.Postfix. RpcHandlers keeps the cached English ConnectionError, upstream version comparisons and logs; names and versions are opaque pattern arguments.",
    "Bulk-fuel and bulk-ammunition messages translate the remaining English items suffix at Character.Message in ShieldGeneratorOnAddFuelPatch.Prefix and Turret_UseItem_Patch.Prefix. The $msg_added game token and count remain unchanged; шт. avoids incorrect Russian declension for different counts.",
    "Update keeps the shared Pull from containers? literal English for LogDebug. The default rich-text question translates as a scoped full line at Localization.Localize; simple question-plus-choice layouts use the scoped pattern. Colored choices are display-only literals. Arbitrary custom layouts outside these known forms are not covered.",
    "Пакет текущего профиля проверен 2026-10-17 по точной установленной DLL и декомпиляции; версия пакета и BepInPlugin сверены отдельно. Игровая приёмка относится к общей квитанции выпуска."
  ],
  "literals": [
    {
      "type": "AzuCraftyBoxes.AzuCraftyBoxesPlugin",
      "method": "Update",
      "values": {
        "<color=green>Yes</color>": "<color=green>Да</color>",
        "<color=yellow>Only mine</color>": "<color=yellow>Только из моих</color>",
        "<color=red>No</color>": "<color=red>Нет</color>"
      }
    },
    {
      "type": "AzuCraftyBoxes.Patches.FireplaceGetHoverTextPatch",
      "method": "Postfix",
      "values": {
        " and ": " и "
      }
    },
    {
      "type": "AzuCraftyBoxes.Patches.TurretGetHoverTextPatch",
      "method": "Postfix",
      "values": {
        " and ": " и "
      }
    },
    {
      "type": "AzuCraftyBoxes.Patches.OverrideHoverTextSg",
      "method": "UpdateAddFuelSwitchHoverText",
      "values": {
        " and ": " и ",
        "\n[<b><color=yellow>{0}</color> + <color=yellow>$KEY_Use</color></b>] Add {1}": "\n[<b><color=yellow>{0}</color> + <color=yellow>$KEY_Use</color></b>] Добавить: {1}"
      }
    },
    {
      "type": "AzuCraftyBoxes.Patches.OverrideHoverText",
      "method": "UpdateAddOreSwitchHoverText",
      "values": {
        "\n[<b><color=yellow>{0}</color> + <color=yellow>$KEY_Use</color></b>] {1} {2} from Inventory & Nearby Containers": "\n[<b><color=yellow>{0}</color> + <color=yellow>$KEY_Use</color></b>] {1} {2} из инвентаря и ближайших сундуков"
      }
    },
    {
      "type": "AzuCraftyBoxes.Patches.OverrideHoverTextFermenter",
      "method": "UpdateAddSwitchHoverText",
      "values": {
        "\n[<b><color=yellow>{0}</color> + <color=yellow>$KEY_Use</color></b>] {1} {2} from Inventory & Nearby Containers": "\n[<b><color=yellow>{0}</color> + <color=yellow>$KEY_Use</color></b>] {1} {2} из инвентаря и ближайших сундуков"
      }
    },
    {
      "type": "AzuCraftyBoxes.Patches.SE_ContainerPull",
      "method": "CreateEffect",
      "values": {
        "Preventing Pulling": "Не брать из сундуков",
        "Prevents pulling from nearby containers & backpacks": "Предметы не берутся из ближайших сундуков и рюкзаков"
      }
    },
    {
      "type": "Backpacks.ItemContainer",
      "method": "GetPressOpenText",
      "values": {
        "Press [": "Нажмите [",
        "] to open": "], чтобы открыть"
      }
    },
    {
      "type": "ServerSync.VersionCheck",
      "method": "ShowConnectionError",
      "values": {
        "\nServer expects you to have ": "\nСервер требует установить ",
        " (Version: ": " (версия: ",
        ") installed.": ")."
      }
    }
  ],
  "namespaces": [
    "AzuCraftyBoxes",
    "Backpacks",
    "ServerSync"
  ],
  "pluginVersion": "1.8.28",
  "rawTexts": {
    "Preventing Pulling": "Не брать из сундуков",
    "Prevents pulling from nearby containers & backpacks": "Предметы не берутся из ближайших сундуков и рюкзаков"
  }
}
