{
  "id": "AdventureBackpacks",
  "package": "Vapok-AdventureBackpacks",
  "version": "2.4.0",
  "pluginVersion": "2.4.0",
  "assembly": "AdventureBackpacks",
  "guids": [
    "vapok.mods.adventurebackpacks"
  ],
  "namespaces": [
    "Vapok.Common.Managers.Skill",
    "Vapok.Common.Managers.Splash",
    "AdventureBackpacks.Assets.Factories"
  ],
  "words": {
    "item_friendlyskeletonwand_spectralshroud_backpack": "Призрачный саван с хранилищем",
    "vapok_mod_item_backpack_plains": "Рюкзак из шкуры быкоящера",
    "vapok_mod_item_backpack_plains_description": "Походный рюкзак из чрезвычайно прочной шкуры быкоящера.",
    "vapok_mod_item_backpack_mistlands": "Рюкзак исследователя со светлячком",
    "vapok_mod_item_backpack_mistlands_description": "Искусно сделанный таинственный рюкзак с собственным волшебным сундуком. Никто толком не знает, как он устроен.",
    "vapok_mod_se_cold_immunity": "Защита от холода",
    "vapok_mod_no_inception5": "Тор лишил вас сил!"
  },
  "englishWords": {
    "item_friendlyskeletonwand_spectralshroud_backpack": "Spectral Shroud of Holding",
    "vapok_mod_item_backpack_plains": "Lox Hide Knappsack",
    "vapok_mod_item_backpack_plains_description": "An adventuring backpack made from extremely durable lox hide.",
    "vapok_mod_item_backpack_mistlands": "Explorers Wisppack",
    "vapok_mod_item_backpack_mistlands_description": "A finely crafted, mystical backpack. Complete with it's own Box of Holding. No one is quite sure how it works.",
    "vapok_mod_se_cold_immunity": "Cold Immunity",
    "vapok_mod_no_inception5": "Thor has stripped you of your powers!!"
  },
  "texts": {
    "A quality-of-life combat mod that automatically equips and manages shields during combat situations.": "Боевой мод для удобства: сам надевает щит и управляет им в бою.",
    "A feature-rich backpack progression system with custom models, effects, and inventory mechanics.": "Развитие рюкзаков с множеством возможностей: свои модели, эффекты и механики инвентаря."
  },
  "patterns": [],
  "returns": [],
  "literals": [
    {
      "type": "Vapok.Common.Managers.Skill.Skill",
      "method": "Patch_Skills_CheatRaiseskill",
      "values": {
        "Skill increased ": "Повышен навык ",
        "Skill ": "Навык "
      }
    },
    {
      "type": "Vapok.Common.Managers.Skill.Skill",
      "method": "Patch_Skills_CheatResetSkill",
      "values": {
        "Skill ": "Навык ",
        " reset": " сброшен"
      }
    },
    {
      "type": "Vapok.Common.Managers.Splash.CyberTooltipTrigger",
      "method": "ShowTooltip",
      "values": {
        "<color=#64f0fc><b>[ ! ] DATA DISCLOSURE:</b></color>\n<color=#c8dbee>": "<color=#64f0fc><b>[ ! ] СБОР ДАННЫХ:</b></color>\n<color=#c8dbee>"
      }
    },
    {
      "type": "Vapok.Common.Managers.Splash.SplashModalComponent",
      "method": "ShowPrivacyOverlay",
      "values": {
        "</b></color> <color=#64f0fc>[ vapok.io/privacy-policy ]</color>  <color=#48607a>|</color>  <color=#ffffff><b>DOC:</b></color> <color=#64f0fc>[ PRIVACY ]</color>": "</b></color> <color=#64f0fc>[ vapok.io/privacy-policy ]</color>  <color=#48607a>|</color>  <color=#ffffff><b>ДОКУМЕНТ:</b></color> <color=#64f0fc>[ КОНФИДЕНЦИАЛЬНОСТЬ ]</color>",
        "VIEW: [ <color=#00f59b>TERMINAL</color> ]": "ВИД: [ <color=#00f59b>ТЕРМИНАЛ</color> ]"
      }
    },
    {
      "type": "Vapok.Common.Managers.Splash.SplashGamepadController",
      "method": "UpdateLegend",
      "values": {
        "</color> <color=#c8d6e5>Back to Mods</color>      <color=#64f0fc>": "</color> <color=#c8d6e5>Назад к модам</color>      <color=#64f0fc>",
        "</color> <color=#c8d6e5>Scroll Policy</color>": "</color> <color=#c8d6e5>Прокрутка политики</color>",
        "</color> <color=#c8d6e5>Select / Toggle</color>      <color=#64f0fc>": "</color> <color=#c8d6e5>Выбрать / переключить</color>      <color=#64f0fc>",
        "</color> <color=#c8d6e5>Close</color>      <color=#64f0fc>": "</color> <color=#c8d6e5>Закрыть</color>      <color=#64f0fc>",
        "</color> <color=#c8d6e5>Navigate</color>      <color=#64f0fc>": "</color> <color=#c8d6e5>Перемещение</color>      <color=#64f0fc>",
        "</color> <color=#c8d6e5>Scroll</color>": "</color> <color=#c8d6e5>Прокрутка</color>"
      }
    },
    {
      "type": "AdventureBackpacks.Assets.Factories.BackpackFactory+<>c__DisplayClass7_0",
      "method": "<ResolveModelBundle>b__0",
      "values": {
        "Adventure Backpacks: Game restart required for model changes to take effect.": "Adventure Backpacks: чтобы сменить модель, перезапустите игру."
      }
    }
  ],
  "prefabs": [],
  "sourceFiles": [
    "source-evidence/profile-updates/Vapok-AdventureBackpacks-2.4.0/AdventureBackpacks.Translations.English.json",
    "source-evidence/profile-updates/Vapok-AdventureBackpacks-2.4.0/AdventureBackpacks/AdventureBackpacks.cs",
    "source-evidence/profile-updates/Vapok-AdventureBackpacks-2.4.0/Vapok.Common.Managers.Skill/Skill.cs",
    "source-evidence/profile-updates/Vapok-AdventureBackpacks-2.4.0/Vapok.Common.Managers.Splash/CyberTooltipTrigger.cs",
    "source-evidence/profile-updates/Vapok-AdventureBackpacks-2.4.0/Vapok.Common.Managers.Splash/SplashModalComponent.cs",
    "source-evidence/profile-updates/Vapok-AdventureBackpacks-2.4.0/il/AdventureBackpacks.il"
  ],
  "notes": [
    "Английский текст взят из кода и ресурсов этой версии мода; русский перевод собственный.",
    "Собственный русский перевод мода сохраняется, кроме шести явно перечисленных replaceNative: исправлены обещание вечного рюкзака, потерянные светлячок и волшебный сундук, название защиты от статуса «Холод» и ошибочное указание на силы Тора вместо сил игрока.",
    "The native Russian gameplay table is preserved outside the explicit replaceNative allowlist. English keys and existing Russian values for those overrides were verified against the AdventureBackpacks 2.2.10 release commit 02d2326596d548199a9f02aa3e65e94c0f514377 (AdventureBackpacks/Translations/English.json and Translations/AdventureBackpacks.Russian.json). ColdResistance.cs removes only the Cold status; EffectsFactory.cs explicitly excludes freezing. Three hard-coded privacy UI headers are translated in their exact display methods; optional ChebsNecromancy content absent from the checked installation is not added.",
    "Пакет текущего профиля проверен 2026-10-17 по точной установленной DLL и декомпиляции; версия пакета и BepInPlugin сверены отдельно. Игровая приёмка относится к общей квитанции выпуска."
  ],
  "replaceNative": [
    "vapok_mod_item_backpack_plains",
    "vapok_mod_item_backpack_plains_description",
    "vapok_mod_item_backpack_mistlands",
    "vapok_mod_item_backpack_mistlands_description",
    "vapok_mod_se_cold_immunity",
    "vapok_mod_no_inception5"
  ]
}
