{
  "id": "CraftyCartsRemake",
  "package": "OdinPlus-CraftyCartsRemake",
  "version": "3.2.4",
  "assembly": "CraftyCartsRemake",
  "guids": [
    "Azumatt.CraftyCarts"
  ],
  "words": {
    "msg_cartupgraded": "$1: улучшение выполнено",
    "msg_cantupgrade": "Невозможно улучшить $1",
    "msg_maxlevel": "$1: уже достигнут максимальный уровень",
    "piece_upgradecart": "Улучшить повозку",
    "piece_upgradecart_description": "Повысить уровень повозки",
    "piecemanager_cat_craftycarts": "Ремесленные повозки"
  },
  "englishWords": {
    "msg_cartupgraded": "$1 has been upgraded",
    "msg_cantupgrade": "$1 can't be upgraded",
    "msg_maxlevel": "$1 is already at max level",
    "piece_upgradecart": "Upgrade Cart",
    "piece_upgradecart_description": "Upgrade your cart to a higher level",
    "piecemanager_cat_craftycarts": "Crafty Carts"
  },
  "texts": {},
  "patterns": [],
  "returns": [],
  "prefabs": [],
  "sourceFiles": [
    "source-evidence/profile-updates/OdinPlus-CraftyCartsRemake-3.2.4/CraftyCartsRemake.translations.English.yml",
    "source-evidence/profile-updates/OdinPlus-CraftyCartsRemake-3.2.4/CraftyCartsRemake/CCR.cs",
    "source-evidence/profile-updates/OdinPlus-CraftyCartsRemake-3.2.4/bundle-strings.json"
  ],
  "notes": [
    "version — версия пакета Gale; pluginVersion и assembly — метаданные приложенной декомпиляции. Игровой запуск не выполнен.",
    "0.5.0: bound to 3.2.4 installed in the profile; cart piece and container names from its asset bundle."
  ],
  "namespaces": [
    "CraftyCartsRemake"
  ],
  "pluginVersion": "3.2.4",
  "rawTexts": {
    "$piece_workbench $tool_cart": "$tool_cart ($piece_workbench)",
    "$piece_workbench $tool_cart Storage": "Хранилище: $tool_cart ($piece_workbench)",
    "$piece_forge $tool_cart": "$tool_cart ($piece_forge)",
    "$piece_forge $tool_cart Storage": "Хранилище: $tool_cart ($piece_forge)",
    "$piece_blackforge $tool_cart": "$tool_cart ($piece_blackforge)",
    "$piece_blackforge $tool_cart Storage": "Хранилище: $tool_cart ($piece_blackforge)",
    "$piece_artisanstation $tool_cart": "$tool_cart ($piece_artisanstation)",
    "$piece_artisanstation $tool_cart Storage": "Хранилище: $tool_cart ($piece_artisanstation)",
    "$piece_cauldron $tool_cart": "$tool_cart ($piece_cauldron)",
    "$piece_cauldron $tool_cart Storage": "Хранилище: $tool_cart ($piece_cauldron)",
    "$piece_stonecutter $tool_cart": "$tool_cart ($piece_stonecutter)",
    "$piece_stonecutter $tool_cart Inventory": "Инвентарь: $tool_cart ($piece_stonecutter)"
  },
  "rawPatterns": [
    {
      "source": "{0} ( $piece_container_empty )",
      "target": "{0} ( $piece_container_empty )",
      "numeric": [],
      "arguments": {
        "0": "text"
      }
    }
  ]
}
