{
  "id": "WorldEditCommands",
  "package": "JereKuusela-World_Edit_Commands",
  "version": "1.81.0",
  "pluginVersion": "1.81",
  "assembly": "WorldEditCommands",
  "guids": [
    "world_edit_commands"
  ],
  "namespaces": [
    "WorldEditCommands"
  ],
  "words": {},
  "englishWords": {},
  "texts": {},
  "patterns": [],
  "returns": [],
  "prefabs": [],
  "literals": [
    {
      "type": "WorldEditCommands.UndoAction",
      "method": "CreateMessage",
      "values": {
        "Changed ": "Изменено: ",
        " + terrain": " + ландшафт",
        "Changed terrain": "Изменен ландшафт",
        "Changed": "Изменено"
      }
    },
    {
      "type": "WorldEditCommands.UndoHelper",
      "method": "Print",
      "values": {
        " objects {0}x": " несколько объектов ({0})"
      }
    },
    {
      "type": "WorldEditCommands.ObjectCommand",
      "method": "Execute",
      "values": {
        "Entity ¤ destroyed.": "Объект ¤ уничтожен."
      }
    },
    {
      "type": "WorldEditCommands.ObjectCommand",
      "method": "MakeTame",
      "values": {
        "¤ made tame.": "Приручено: ¤.",
        "Skipped: ¤ is not a creature.": "Пропущено: ¤ — не существо."
      }
    },
    {
      "type": "WorldEditCommands.ObjectCommand",
      "method": "MakeWild",
      "values": {
        "¤ made wild.": "Приручение отменено: ¤.",
        "Skipped: ¤ is not a creature.": "Пропущено: ¤ — не существо."
      }
    },
    {
      "type": "WorldEditCommands.TerrainCommand",
      "method": "GetCompilers",
      "values": {
        "Unable to select any terrain": "Не удалось выбрать ландшафт"
      }
    }
  ],
  "sourceFiles": [
    "source-evidence/profile-updates/JereKuusela-World_Edit_Commands-1.81.0/WorldEditCommands/ObjectCommand.cs",
    "source-evidence/profile-updates/JereKuusela-World_Edit_Commands-1.81.0/WorldEditCommands/TerrainCommand.cs",
    "source-evidence/profile-updates/JereKuusela-World_Edit_Commands-1.81.0/WorldEditCommands/UndoAction.cs",
    "source-evidence/profile-updates/JereKuusela-World_Edit_Commands-1.81.0/WorldEditCommands/UndoHelper.cs",
    "source-evidence/profile-updates/JereKuusela-World_Edit_Commands-1.81.0/WorldEditCommands/WorldEditCommands.cs",
    "source-evidence/profile-updates/JereKuusela-World_Edit_Commands-1.81.0/il/WorldEditCommands.il"
  ],
  "notes": [
    "English is hard-coded in WorldEditCommands.dll. Infinity Hammer undo/redo keys and its default hoe tools (terrain, object remove/tame) run these commands, and single-object results reach the screen through Server Devcommands Helper.AddMessage; the literals cover those messages.",
    "Console help and console-only output of the world edit commands are left in English in this pass.",
    "Пакет текущего профиля проверен 2026-10-17 по точной установленной DLL и декомпиляции; версия пакета и BepInPlugin сверены отдельно. Игровая приёмка относится к общей квитанции выпуска."
  ]
}
